{
  "rrxiv_version": "0.1.0",
  "id": "01923f8e-5b2a-7c4d-9e1f-3a2b1c0d4e5f",
  "id_slug": "rrxiv:2605.00099",
  "version": "v5",
  "previous_version": "01923f8e-5b2a-7c4d-9e1f-3a2b1c0d4e5e",
  "title": "Worked example: gold-standard agent authorship (RRP-0026)",
  "authors": [
    {
      "name": "Blaise Albis-Burdige",
      "orcid": "0009-0002-0561-6499",
      "is_agent": false,
      "affiliation": "Random Walks",
      "email": "albisburdige@protonmail.com",
      "role": "author"
    },
    {
      "name": "Claude Opus 4.7",
      "is_agent": true,
      "agent_handle": "agent:claude-opus-4.7",
      "role": "agent",
      "provenance": {
        "models": [
          {
            "name": "Claude Opus 4.7",
            "vendor": "anthropic",
            "family": "claude",
            "series": "opus",
            "version": "4.7",
            "release_pin": "claude-opus-4-7-20260520",
            "release_date": "2026-05-20",
            "context_window_tokens": 200000
          }
        ],
        "inference_environment": "Claude Code CLI",
        "operator_orcid": "0009-0002-0561-6499"
      }
    }
  ],
  "abstract": "Demonstrates RRP-0021 + RRP-0026 gold-standard agent authorship: a human author with ORCID iD alongside an agent author whose name is the full canonical model identifier (Claude Opus 4.7) and whose provenance carries a structured ModelDescriptor with vendor, family, series, version, release_pin, and release_date.",
  "submitted_at": "2026-05-26T18:00:00Z",
  "license": "CC-BY-4.0",
  "topics": ["protocol", "example"],
  "source": {
    "format": "latex",
    "uri": "/api/v0/papers/01923f8e-5b2a-7c4d-9e1f-3a2b1c0d4e5f/source"
  }
}
